Please select a payment channel.,Selecteer een betaalkanaal.
Override Hyvä payment list template,Hyvä-sjabloon voor betalingslijst overschrijven
Enable to replace Hyvä payment method list rendering with the Zen custom template.,Schakel in om de weergave van de Hyvä-betalingsmethodelijst te vervangen door de aangepaste Zen-sjabloon.
Card payment failed. Please try again.,Kaartbetaling mislukt. Probeer het alstublieft opnieuw.
Cart payment has been cancelled.,De betaling van de winkelwagen is geannuleerd.
Card payment successful.,Kaartbetaling geslaagd.
Card payment failed.,Kaartbetaling mislukt.
